{
  "passport_version": "0.1",
  "identity": {
    "passport_id": "pp-001",
    "agent_id": "a1",
    "issuer": "test-issuer"
  },
  "validity": {
    "issued_at": "2026-01-01T00:00:00Z",
    "expires_at": "2099-12-31T00:00:00Z"
  },
  "revocation": {
    "revoked": false
  },
  "attestation": {
    "issuer": "test-issuer"
  }
}
